{
  "$schema": "https://json-schema.org/draft/2020-12/schema",
  "$id": "https://example.invalid/schemas/catalog.schema.json",
  "title": "Create Anything AI Stack Catalog",
  "description": "Validates stacks/catalog.json, the canonical index of proposed stack combinations. Structural rules that JSON Schema cannot express (exact stack count, globally unique IDs, contiguous numbering, ID/number agreement) are enforced by the catalog validator.",
  "type": "object",
  "additionalProperties": false,
  "required": [
    "schemaVersion",
    "catalogVersion",
    "maturityPolicy",
    "categoryPolicy",
    "stacks"
  ],
  "properties": {
    "schemaVersion": {
      "type": "string",
      "const": "1.0.0"
    },
    "catalogVersion": {
      "type": "string",
      "pattern": "^[0-9]+\\.[0-9]+\\.[0-9]+$"
    },
    "maturityPolicy": {
      "description": "The complete, ordered set of allowed maturity values. Every stack maturity must be a member of this list.",
      "type": "array",
      "items": {
        "$ref": "#/$defs/maturity"
      },
      "minItems": 1,
      "uniqueItems": true
    },
    "categoryPolicy": {
      "description": "The complete set of allowed category slugs. Every stack category must be a member of this list.",
      "type": "array",
      "items": {
        "$ref": "#/$defs/category"
      },
      "minItems": 1,
      "uniqueItems": true
    },
    "stacks": {
      "type": "array",
      "minItems": 1,
      "items": {
        "type": "object",
        "additionalProperties": false,
        "required": [
          "id",
          "number",
          "category",
          "maturity"
        ],
        "properties": {
          "id": {
            "$ref": "#/$defs/stackId"
          },
          "number": {
            "type": "integer",
            "minimum": 1
          },
          "category": {
            "$ref": "#/$defs/category"
          },
          "maturity": {
            "$ref": "#/$defs/maturity"
          }
        }
      }
    }
  },
  "$defs": {
    "maturity": {
      "description": "Maturity states accepted by the repository quality gates. A stack only advances after its gate evidence is recorded. Single source of truth: stack-manifest.schema.json references this definition.",
      "enum": [
        "proposed",
        "spec-ready",
        "scaffolded",
        "verified",
        "production-reference",
        "blocked"
      ]
    },
    "category": {
      "description": "Machine-readable category slugs used in catalog.json, stack manifests, and documentation tables. Single source of truth: stack-manifest.schema.json references this definition.",
      "enum": [
        "enterprise-cross-platform",
        "baas",
        "classic-web",
        "ai-native",
        "mobile-first",
        "desktop",
        "native",
        "realtime",
        "realtime-3d"
      ]
    },
    "stackId": {
      "description": "Two-digit number prefix followed by lowercase alphanumeric segments; must agree with the entry's number.",
      "type": "string",
      "pattern": "^[0-9]{2}-[a-z0-9]+(?:-[a-z0-9]+)*$"
    }
  }
}
