{
  "schemaVersion": "1.0.0",
  "catalogVersion": "0.1.0",
  "maturityPolicy": [
    "proposed",
    "spec-ready",
    "scaffolded",
    "verified",
    "production-reference",
    "blocked"
  ],
  "categoryPolicy": [
    "enterprise-cross-platform",
    "baas",
    "classic-web",
    "ai-native",
    "mobile-first",
    "desktop",
    "native",
    "realtime",
    "realtime-3d"
  ],
  "stacks": [
    {
      "id": "01-java25-springboot-react-flutter",
      "number": 1,
      "category": "enterprise-cross-platform",
      "maturity": "scaffolded"
    },
    {
      "id": "02-java25-springboot-angular-ionic",
      "number": 2,
      "category": "enterprise-cross-platform",
      "maturity": "scaffolded"
    },
    {
      "id": "03-dotnet9-blazor-react-maui",
      "number": 3,
      "category": "enterprise-cross-platform",
      "maturity": "proposed"
    },
    {
      "id": "04-go-fiber-htmx-flutter",
      "number": 4,
      "category": "enterprise-cross-platform",
      "maturity": "scaffolded"
    },
    {
      "id": "05-nestjs-typeorm-nextjs-reactnative",
      "number": 5,
      "category": "enterprise-cross-platform",
      "maturity": "proposed"
    },
    {
      "id": "06-kotlin-ktor-compose-multiplatform",
      "number": 6,
      "category": "enterprise-cross-platform",
      "maturity": "proposed"
    },
    {
      "id": "07-rust-actix-leptos-tauri",
      "number": 7,
      "category": "enterprise-cross-platform",
      "maturity": "proposed"
    },
    {
      "id": "08-supabase-react-vite",
      "number": 8,
      "category": "baas",
      "maturity": "scaffolded"
    },
    {
      "id": "09-supabase-nextjs-tailwind",
      "number": 9,
      "category": "baas",
      "maturity": "proposed"
    },
    {
      "id": "10-supabase-flutter-dart",
      "number": 10,
      "category": "baas",
      "maturity": "proposed"
    },
    {
      "id": "11-supabase-react-native-expo",
      "number": 11,
      "category": "baas",
      "maturity": "proposed"
    },
    {
      "id": "12-firebase-angular-ionic",
      "number": 12,
      "category": "baas",
      "maturity": "scaffolded"
    },
    {
      "id": "13-appwrite-vue3-quasar",
      "number": 13,
      "category": "baas",
      "maturity": "proposed"
    },
    {
      "id": "14-pocketbase-sveltekits-tailwind",
      "number": 14,
      "category": "baas",
      "maturity": "proposed"
    },
    {
      "id": "15-laravel12-vue3-inertia-flutter",
      "number": 15,
      "category": "classic-web",
      "maturity": "scaffolded"
    },
    {
      "id": "16-laravel12-livewire-alpine-tailwind",
      "number": 16,
      "category": "classic-web",
      "maturity": "scaffolded"
    },
    {
      "id": "17-laravel12-react-inertia-reactnative",
      "number": 17,
      "category": "classic-web",
      "maturity": "scaffolded"
    },
    {
      "id": "18-mern-typescript-express-react-native",
      "number": 18,
      "category": "classic-web",
      "maturity": "scaffolded"
    },
    {
      "id": "19-pevn-express-vue3-capacitor",
      "number": 19,
      "category": "classic-web",
      "maturity": "scaffolded"
    },
    {
      "id": "20-fastapi-react-vite-pwa",
      "number": 20,
      "category": "classic-web",
      "maturity": "scaffolded"
    },
    {
      "id": "21-django5-htmx-alpine-tailwind",
      "number": 21,
      "category": "classic-web",
      "maturity": "scaffolded"
    },
    {
      "id": "22-rails8-hotwire-tailwind-kamal",
      "number": 22,
      "category": "classic-web",
      "maturity": "proposed"
    },
    {
      "id": "23-fastapi-langchain-qdrant-nextjs",
      "number": 23,
      "category": "ai-native",
      "maturity": "scaffolded"
    },
    {
      "id": "24-springboot-springai-pgvector-react",
      "number": 24,
      "category": "ai-native",
      "maturity": "proposed"
    },
    {
      "id": "25-nextjs-verceled-ai-sdk-pinecone",
      "number": 25,
      "category": "ai-native",
      "maturity": "proposed"
    },
    {
      "id": "26-litellm-ollama-python-chainlit",
      "number": 26,
      "category": "ai-native",
      "maturity": "proposed"
    },
    {
      "id": "27-mastra-typescript-agents-nextjs",
      "number": 27,
      "category": "ai-native",
      "maturity": "proposed"
    },
    {
      "id": "28-flutter-local-rag-onnx-objectbox",
      "number": 28,
      "category": "ai-native",
      "maturity": "proposed"
    },
    {
      "id": "29-flutter-go-grpc-protobuf",
      "number": 29,
      "category": "mobile-first",
      "maturity": "proposed"
    },
    {
      "id": "30-react-native-expo-supabase-tamagui",
      "number": 30,
      "category": "mobile-first",
      "maturity": "proposed"
    },
    {
      "id": "31-tauri2-rust-react-vite-desktop",
      "number": 31,
      "category": "desktop",
      "maturity": "proposed"
    },
    {
      "id": "32-electron-typescript-react-sqlite",
      "number": 32,
      "category": "desktop",
      "maturity": "proposed"
    },
    {
      "id": "33-swiftui-vapor-postgresql",
      "number": 33,
      "category": "native",
      "maturity": "proposed"
    },
    {
      "id": "34-jetpack-compose-ktor-postgres",
      "number": 34,
      "category": "native",
      "maturity": "proposed"
    },
    {
      "id": "35-dotnet9-signalr-react-redis",
      "number": 35,
      "category": "realtime",
      "maturity": "scaffolded"
    },
    {
      "id": "36-go-gorilla-websockets-vue3",
      "number": 36,
      "category": "realtime",
      "maturity": "scaffolded"
    },
    {
      "id": "37-elixir-phoenix-liveview-postgres",
      "number": 37,
      "category": "realtime",
      "maturity": "proposed"
    },
    {
      "id": "38-node-socketio-express-react-kafka",
      "number": 38,
      "category": "realtime",
      "maturity": "proposed"
    },
    {
      "id": "39-rust-tokio-axum-websockets-yew",
      "number": 39,
      "category": "realtime",
      "maturity": "proposed"
    },
    {
      "id": "40-python-fastapi-websockets-threejs",
      "number": 40,
      "category": "realtime-3d",
      "maturity": "proposed"
    }
  ]
}
